<?xml version="1.0" encoding="UTF-8"?>
<danielpm1982:email
	xmlns:xsi="http://www.w3.org/2001/XMLSchema-instance"
	xsi:schemaLocation="http://www.danielpm1982.com/EmailNamedTypesMethod EmailNamedTypesMethod.xsd"
	xmlns:danielpm1982="http://www.danielpm1982.com/EmailNamedTypesMethod"
	emailId="100">
	<danielpm1982:from>
		<danielpm1982:name>name1name1name1name1name1name1name1name1name1name1</danielpm1982:name>
		<danielpm1982:email>name1@name.com</danielpm1982:email>
	</danielpm1982:from>
	<danielpm1982:to>
		<danielpm1982:name>name2name2name2name2name2name2name2name2name2name2</danielpm1982:name>
		<danielpm1982:email>name2@name.com</danielpm1982:email>
	</danielpm1982:to>
	<danielpm1982:dateTime>2019-12-01T16:00:00</danielpm1982:dateTime>
	<danielpm1982:text>Hello World! Hello World! Hello World! Hello World!
		Hello World! Hello World! Hello World! Hello World! Hello World! Hello
		World! Hello World! Hello World! Hello World! Hello World! Hello
		World! Hello World! Hello World! Hello World! Hello World! Hello
		World! Hello World! Hello World! Hello World! Hello World! Hello
		World! Hello World! Hello World! Hello World! Hello World! Hello
		World! Hello World! Hello World! Hello World! Hello World! Hello
		World! Hello World! Hello World! Hello World! Hello World! Hello
		World! Hello World! Hello World! Hello World! Hello World! Hello
		World! Hello World! Hello World! Hello World! Hello World! Hello
		World! Hello World! Hello World! Hello World! Hello World! Hello
		World! Hello World! Hello World! Hello World! Hello World! Hello
		World! Hello World! Hello World! Hello World! Hello World! Hello
		World! Hello World! Hello World! Hello World! Hello World! Hello
		World! Hello World! Hello World! Hello World! Hello World! Hello
		World! Hello World! Hello World! Hello World! Hello World! Hello
		World! Hello World! Hello World! Hello World! Hello World! Hello
		World! Hello World! Hello World! Hello World! Hello World! Hello
		World! Hello World! Hello World! Hello World! Hello World!</danielpm1982:text>
</danielpm1982:email>
